User Name,Star,Review Title,Review Text,Review Posted Time
boblipton,6,Next Phase,"It was an okay movie. Simu Liu is the son of the seemingly immortal master of the Ten Rings --always good to see Tony Leung, and I hope he soaked Disney --who winds up opposing his dad, and Awkwafina is his slacker sort-of girlfriend. They are fine in the leads, as is Meng'er Zhang as his sister, and Michelle Yeoh as their aunt -- always good to see her, and I hope she soaked Disney too.

I have grown increasingly fond of martial arts films over the last couple of decades, and the decline of the movie musical is the reason why. They don't make movies like that any more, and when they try, they're often embarrassing. People don't like the unreality of people bursting out into song, or expressing their emotions through dance. No, they prefer the solid commonplace of people floating through space to kick each other in the head. To me, the fight choreography is its own dance, and the fight between Leung and Fala Chen when they meet and before they fall in love is a challenge dance as graceful as any between Astaire and Rogers.

There are problems aplenty with this film. There's an immense amount of exposition, starting off with twenty minutes of it in Chinese. I'm not sure why Ben Kingsley as the fake 'Mandarin' from IRON MAN 3 is present except for a certain remnant of star power and connecting this to the rest of the MCU. Still, with my expectations not set particularly high, I had a good time.",11-Sep-21
qnbhdga,2,Shang-Chi Review,"Overall very disappointing (as expected) another generic marvel flop. It will obviously make no money, because nobody has never heard of this ""superhero"".",3-Sep-21
hfaic,1,Very Obviously Will Fail at Box Office and For a Good Reason,"It's simply too generic and jokes don't land at all. Not recommending, maybe wait for streaming.",3-Sep-21
kinejin,5,Kinejin,null,19-Sep-21
Rlyt96,8,Better than I expected,"When I saw the trailer a while back I wasn't expecting much, especially after Black Widow which was imo the worst MCU movie. However, the movie surprised me. The theme of a different culture reminded me of Black Panther but I enjoyed Shang Chi a lot more. I found it refreshing, the visuals were amazing, I enjoyed the action scenes very much. The plot wasn't the worst, but I felt like it was dragging out at times.

Overall a very fun and enjoyable movie.",10-Sep-21
Tralalalilili,10,Beautiful!,"I just simply love how beautiful this movie is! The actions, the visual, everything!",10-Sep-21
liumike1981,9,Nearly perfect,null,9-Sep-21
wind90,10,This is DEFINETLY not a waste (for a marvel film),"---Fast review: Good effect, exciting figth scenes, satisfying story---

> I normally don't like most marvel movies because bla bla.. > However, as a martial arts fan, performer and chinese culture and mythology fan, i decided to watch it (because there is use of martial arts) and unexpectedly satisfied.

> There is a good base, universe of chinese mythology. They may waste it but they definetly use it very well. Effects are realy good, i especially like effects of portals and water tornado of dragon.

> Fight scenes (which is the most interested part for me of course) are really good, some parts are so fast to detect movements.

> Visual effects of kung fu (not style of main character but his mother and her people) describe the philosophy under the style very well. Their kung fu is so smooth, basic and easily recognisable because most is traditional style.

>I was very happy when i saw some movements that i use.",9-Sep-21
masonsaul,9,Incredible MCU origin story,"Shang-Chi and the Legend of the Ten Rings is an incredible MCU origin story that's epic, emotional and extremely thrilling whilst also connecting to the greater universe in fun and satisfying ways. It's definitely the best thing in phase 4 so far even if it's third act has some of the usual MCU problems.

Simu Liu gives an incredible and extremely charismatic lead performance whilst also having superb chemistry with Awkwafina, who is also incredible. Michelle Yeoh and Meng'er Zhang are both great and Tony Leung is amazing as one of the better villains in the MCU with plenty of backstory and depth.

Destin Daniel Cretton's direction is excellent, it's extremely well filmed and stylish with some of the best action sequences in the franchise. The fight choreography is extremely impressive and the CG is mostly strong. It's well paced and both the soundtrack and the music by Joel P. West are both fantastic.",4-Sep-21
aidanratesmovies,9,"A fun time at the movies, and that's all it really needed to be","Charming and incredibly fun- Shang-Chi may not be the best Marvel has had to offer- but it is one of their better films in some time. My main problems with the film lie in the films storyline, which to be honest, is really good, but incredibly all over the place editing wise and there is just so much of it that it feels like two movies could have been made out of it. I love that we get a more in depth look at our characters, their flaws, their regrets, the tragedy in their lives- but the editing makes it feel rather out of place at times- and takes away from the impact the film could have had and its heart. That being said, the film still manages to be very enjoyable throughout. The action scenes are absolutely incredible, the look of the film incredibly well developed- something very fresh and original for Marvel studios- and the cast are all a joy to watch- especially Simu Liu and Aquafina in the lead and supporting roles. I was skeptical of Aquafina being in a Marvel movie for sure, but she really helped the film as a whole, and honestly I would love to see more of her character in future Marvel projects. The film is entertaining, despite the pacing of the film being a bit all over the place at times. It has some brilliant, elaborate special effects that you will be gawking at on the screen, and plenty of surprises that will be bound to make you smile. In the end, Shang-Chi was a fun time for a Marvel movie- something most comic-book flicks have forgotten about recently- and i'm excited what this character has to offer in future films.

My Rating: 8.6/10.",4-Sep-21
samidi-23078,5,"Not bad , not great",Honestly I start doubting that I saw another movie ! I don't know what all the hype about !! Another Marvel movie packed with a lot of action scenes and visual effects but weak and predictable story !,6-Sep-21
Gwendlyn007,10,Shang-Chi's Beautifully Executed,"Clever story with amazing martial arts and interesting backdrops. I enjoyed and appreciated the English Subtitles that were clear to read and on onscreen longer the most movie subtitles. The martial arts was exhilarating! Loved it! The CGI was colorful and creative. This film should win multiple Oscar Awards!!

This movie was so entertaining I must see it again!!",3-Sep-21
sthomp15,6,"The extra positive reviews are from ""woke white people"" who don't watch Kung Fu flicks lol","Marvel had a huge opportunity to make this so much bigger and better than just a premise movie.

Beautiful cinematography and the choreography was more than just stunt work. Acting a little rough here and there, the protagonist actor did a pretty good job though. That dry MCU humor we've grown to see didn't quite hit. I know a lot of people wished they would have done much more with Mandarin as he is a pretty big bad in the comics and they hyped him up a lot. But I think this movie just makes people excited for THE NEXT marvel movie rather than truly giving this MCU story life. And with the movie being 2 hours long, it felt so rushed and at the same time most viewers were waiting for it to just end.

And I'll say it, she could be a nice gal but Awkwafina.... I just know I'm not the only one who finds her out of place on screen sometimes. And that's all I will say about that respectfully lol.",15-Sep-21
deothor,7,"Average and flawed, yet fine overall","This movie is both fine, yet very flawed. The first issue is pacing. It's quite exhausting. Action-break-flashback-action-flashback-action-break-break-break-flashback-action. It's as if you tried to first sprint, then suddenly halt and tip-toe-walk and then run a marathon only to sprint again.

Second issue are flashbacks. This movie is riddled with them. And I don't mind them.. Unless they keep on returning to exactly the same scene over and over and over again with that difference that you get to listen to new part of the talk. I don't remember any other movie that was so riddled with flashbacks.

Third issue are fights. Now this has to be broken in 2 groups; ""magical fights"" and ""down to earth fights"". The first was done terribly. Camera shake, way too close, badly lighted and confusing as heck. There was some vision, some idea, yes, but it turned into ""cgi slosh"". This could have been done oh-so-much better.. But we got pointless confusing close-ups then camera shaky-shaky moments instead. The second group reminds me of jackie chan movies, you know.. kung-fu stuff, which was great... To some extend.

Fourth issue is main character. He's the extend from point earlier. He's like blank-slate punching bag in this show. He has no real emotions and just goes with the flow. He >never< speaks his mind and rather just silently mumbles his agreement for whatever plan others come up with. It was annoying. Really grating. Ok, I don't mind if MC is not an iron man of a character. But I had seen corpses put more action while being decomposing than Shang chi. Also he gets beaten pretty much all the time. There are only 3'ish exceptions where he shows real emotions. And again.. shoddy pacing cripples them slightly.

The Second character, his friend - Katey (i think).. she was fine. She was active and I couldn't shake this feeling that she's the brains of the team with witty humor, while he's broody muscle man with past.

There were few amazing scenes, which i loved alot, really. But beyond that it was just mediocre. Thank god it was ""just"" mediocre, considering what things marvel relases lately. Mediocre is fine. Really. Tiresome, extended to the point of exhausting... But fine! A (not so) solid 7!

Oh also, there are quite a few plot holes and whatnot ranging from minor (assassins using stun weapons ONLY - lol) to extreme (spoilery stuff).. but at this point.. i just can't even bother. Just roll my eyes and force my brain to stop thinking about it. To become a script writer in 202x all you need to know is how to sniff glue with class and how to agree to everything corporate monkeys in expensive suits tell you.

Should you watch it? If Marvel fan.. you already seen it. If you aren't marvel fan, but still enjoy sci-fi/fantasy... Eh... Not like there's anything better to do I guess.",15-Sep-21
SPZMaxinema,8,Not a bad Marvel movie!,"The action and camera work in particular, along with the cast were very impressive! What I didn't like about it though were just a couple of throw-away nuisance characters and some of the weird humor. Other than that, I'd say it's worth a watch! Plus, it was good seeing some old Marvel faces!",12-Sep-21
smjb-47946,9,JUST AMAZING,"Loved it all. The comedy, the story, the acting, the special effects. A new character of Marvel with a lot of potencial. Hope to see a lot more of this in next movies.",12-Sep-21
Bubba32618,9,This is one of the great MCU movies!,null,12-Sep-21
yougoboy27,9,Good looking and good feeling movie.,"It was fun, beautiful, and different. Very watchable and rewatchable which is an important quality in action movies. Go see it while it's in the theater because it is a pretty set film best seen on the big screen.",12-Sep-21
mdhumayonkabir,7,The story is good but there is problems with other aspects of this movie.,"The best aspects of this movie is hand to hand combats(without the rings) and Simu Liu is awesome in it and embraces the character. The story is good if consider standalone which it is but I have problems with other aspects of movie elements. The entire movie is shooted in closed studio environment with huge set pieces (Marvel is doing such things for last many movies e.g, the last 2 Avengers movies). It is very very very stupid to look at and the non sensical vfx. Still remember the first Iron man movie in which the original and vfx elements are hard to distinguish and have had a good balance in reality and fantasy world. The movie is forcing the humours too in some cases. In some case they tried to mimic Crouching Tiger Hidden Dragon. This movie certainly have some asian vibe in movie making style but I think there were manipulation in making by studio over creator. The music of the movie is good. Overall it's a good movie. I am going to give any special attention for other upcoming marvel movies( Maybe because I left behind my fantasy world). I think there will not be any 'Classic' from marvel in upcoming future.",12-Sep-21
thepriceofpayne,9,The Legend is Now,"Shang-Chi is a character I and many others, know very little about. Which in Marvels case offers up a clean slate to tell a fresh story. I'm happy to say they have delivered. Marvel's newest outing is a Kung-Fu superhero extravaganza, that is fully built on it's action and set pieces. The performances of Simu Liu and Tony Leung stand out amongst the pack and offer a great and rich story for Marvels Cinematic Universe. Though the film can at times feel bogged down by its origin story tropes, the direction of Destin Daniel Cretton, the overall charm of its cast, and story make the film feel fresh and lively. I'm happy to welcome this crew to the ever growing MCU and cannot wait to see what comes next. Hopefully more Shang-Chi!",12-Sep-21
josejpecino,10,Fantastic Movie,"I finally took the plunge and went to cinema for the first time since 2019. The movie was highly entertaining with engaging characters and a good story too. The action and fights scenes seemed very well choreographed and the special effects were a joy to experience on the big screen.

It was a Marvel film that didn't feel like a Marvel film, which shows how versatile the MCU is becoming.

I was highly impressed to see and hear characters speak in their native language, a risk as many people don't like to read subtitles, but being an avid fan of Asian cinema I was quite happy and comfortable to do so.

Overall, a highly entertaining and fun film from Marvel.

I highly recommend it. A+++",9-Sep-21
dan_slentz,7,Excellent Movie.. Stands on it's own without seeing any others.,"""Reel Tunez: The Radio Show All About the Movies"" Movie Review (9/8/21): ""Shang-Chi and the Legend of the Ten Rings""

First, when people on IMDB rate a movie (though VERY good) a 9 or 10, I really want to ask ""So it's a 10.. the VERY BEST movie EVER.. as good as ""Sound of Music"", ""Gone with the Wind"", ""Oliver"", ""Star Wars"" and movies that probably DO get a 9 or 10?? To me.. YES.. an excellent movie. But people skew the ratings by calling everything a 9 or 10. With that said, I'd give it between a 7 and 8 (which is VERY good), but a little closer to a 7 (7.4).

Yet another Marvel Studio (Disney) release to the Marvel Universe. I knew nothing about this movie and didn't really have a lot of interest in seeing it, but GLAD I did! It was fun.. and it was exciting! Excellent adventure movie that had great effects and great story line.

If you like adventure movies.. even if you haven't followed the Marvel Universe, you really don't have to know the history of the other movies to enjoy this one.

I will add the following (which is not a spoiler): Do NOT leave the movie until the very VERY last of the credits have rolled and they turn on the lights to clean the place. As the movie ends, we go into one last restaurant scene. Then in the middle of the credits, we get MORE story. Then after the last of the credits.. even after ""Marvel Studio Cleaning Crew: Bob the Janitor and Mae his wife"", we get ONE more scene at the end. These Marvel extras are consistent and basically a clue into what comes next.

On a 1-10 scaled, I'd give this a very good 7.4! This is a BIG screen movie, so see it at the theater.",9-Sep-21
jvinsnyc,10,Awsome Screen,"Really nice concept with great Direction, teams work & VFX. I really enjoy the movie 🤗",8-Sep-21
Rayofsun71,9,Up there with Black Panther,"I've been a Marvel fan for a long time now and I must say this is Black Panther level impressive. A great origin story, great characters and visual effects and of course the action. Any Marvel's fan will absolutely love it and if you're new to the scene this is a great start.",8-Sep-21
kaskuserlie,10,"Fun, Exciting, Culture Rich","Its was great, finally after so long we got to experience good origins story. I know kevin feige will nailed it even after lot of people thought its gonna flop.

The movie is like a mixture between western and eastern culture afterall the protagonist is an asian living in american.

The raw choreography is the best in the MCU, better than Winter Soldier. The CGI fights is not bad but i think they should do more of the raw realistic fight scene more because its the most appealing part of the movie.

Tony Leung is so charismatic even if he is a villain, i can feel sympathetic to his character. The new mythology is cool, the fantastic beast is awesome too I hope we can see a sequels.",8-Sep-21
erikahawj-22103,10,It was more than I expected!,"As an Asian-American, I am no stranger to the cliche martial art scenes and corniness of it all. I went in fully expecting everything about this movie to be cheesy and cliche like Mulan was. Boy, was I wrong! Shang-Chi was so beautifully written, acted, and directed! I really want to give a huge shout out to the directors for their incorporation of Asian culture into this movie without making everything a cliche or a punch-line. I teared up watching people who looked like me be the main actors on a big screen and not the punch-line of a joke.

Now, onto the story, the story was alright. It wasn't the best, but it's an introductory movie to the hero so not much to expect there other than your typical hero introductory tropes.

The OST's of this movie were off the charts! I really enjoyed the music they had and think they nailed it.

Need I say more about the acting? Tony Leung, Sima Liu, Awkwafina, Michelle Yeoh...These are the best of the best for Asian American actors and they nailed every scene they had in the movie!

Lastly, I absolutely loved the cinematography and the fight scenes. They were well thought out and choreographed. It didn't seem cheesy or corny. Thank you Marvel for making this movie and paying homage to Asian Americans. This movie will be one that I will never forget!",7-Sep-21
torgis,10,My new favourite origin,"All I can say is ""wow"". I loved the cinematography, I was amazed by the choreography and the fact it wasn't hidden or obscured through camera angles like some previous movies, and I now love Simu Liu and think he is an incredible addition to the MCU, along with Awkwafina.

The ""villain"" of the story, Wenwu, played by the amazing Tony Leung, had incredible character depth and was certainly not a stereotypical bad guy.

Aside from a couple of awkward phrases, I loved everything about this movie and am so glad I was able to support it during their opening weekend. If it wasn't COVID, I would've went to see it again by now. Highly recommend.",7-Sep-21
susannaaleksanyan,7,A generic marvel movie,null,7-Sep-21
maxepple,10,Beautifully stunning action story tale,"As a huge fan of the IP Man and Marvel movies I feel that this movie was a beautiful balance between insane action and beautiful backdrops and wonderful mystical powers. Growing up watching old-school kung fu movies and then finding superhero movies on my own and loving them, I feel this movie is a perfect blend of everything I want from modern action cinema.",7-Sep-21
fredrickosoliviasmack,9,Perfect,"This film is full of surprises, and really perfect.",6-Sep-21
Ahmad_Hasib,10,Best Solo Origin Movie After Dr. Strange,"Watched it yesterday. Overall the movie was wonderful. MCU put everything so perfectly. The cast, visuals, CGI everything was on pinpoint. Every Characters performance was brilliant. I need to mention this because without this character the movie would not be that interesting and that role is played by Awkwafina as Katy. Her comic timing was so good. And as always marvel surprised me to have the villain as Tony Chiu-Wai Leung as as Xu Wenwu. His performance was brilliant along with our new hero Simu Liu as Shang Chi.

Definitely worth of time. Go watch the movie in the theatre and don't spoil.",6-Sep-21
timone-shimone,9,A must see for fans of martial arts action and Chinese fantasy,"What a great flick. The action was amazing throughout, constantly growing and changing so the fights never got boring. Awkwafina is a favourite of mine and did a great job. Family relationships really do make the most compelling of stories. We got an Antagonist that had a tragic and understandable story, he never felt 1 dimensional like so many other hero rising villains.",6-Sep-21
marielaportill,10,Favorite Marvel origin film yet,"Shang-Chi was BEYOND my expectations. Some of the best acting, fight choreography, and visual effects I've seen from Marvel in a while. The story itself had so much heart.",6-Sep-21
rudranarayanbehera-08966,9,Just Wow,"This movie is fabulous.. Writings for every character was brilliant. Action sequences were beyon my imagination..

Worth watching...

Phrase 4 begins with a blast.",6-Sep-21
abbeyleech,9,Superb!!,"I went into this hoping for fresh ideas but with low expectations and BOY was I surprised. This film was amazing! The casting, script, acting and everything else in between. Marvel really smashed this.",6-Sep-21
DoNotComeToTheCinemaDepressed,10,THE CINEMA WAS BUZZING. WHAT A CINEMATIC EXPERIENCE. KATY STOLE THE SHOW.📀📀📀📀📀📀📀📀📀📀,"The Cinema Was On Fire, I think It was Partly to do with Katy and Her Crazy Energy. And Also That Bus Fight Scene Was Incredible, it really got things going.

It's A Very Funny Movie too, Laughs Were Coming From The Audience Frequently. It Was Such a Great Time.

Good Story, Amazing Visuals, Good Comedy, Some Nice Fights.

Also The Ten Rings in Action Were Spectacular To Watch. The Ten Rings Are Brutal.

It's A Major World Event For the Official Start Of the New MCU (Black Widow is a Prequel).

Overall, As A Movie It is Probably An 8 Out Of 10 but Because of the Cinematic Experience, that Changes the Game Completely. It Was A Major Cinematic Experience. 10 Stars 🌟 For The Ten Rings 📀",5-Sep-21
kelly-gaudreau,10,Amazing Visuals,Another amazing Marvel film with awesome visual effects. I think they did a great job blending Asian culture within film. Give me more second-tier Marvel characters.,5-Sep-21
aidendaly,10,New realm of marvel entertainment,"If you are a fan of the character, you will love it, marvel is opening up to new realms and its going to be intense... next up eternals let's go!!!",5-Sep-21
lukerandall,10,One of the best Marvel stand-alone films!,"Can't wait to see what else is to come from Shang Chi.

Fantastic from start to finish!

Well worth the watch.",5-Sep-21
