User Name,Star,Review Title,Review Text,Review Posted Time
Sjr-lane,7,Middle-of-the-pack MCU film.,"There's a lot to love about Shang-Chi. There's also a lot to grimace about. Both feelings lurk beneath the surface and draw awareness to themselves at various times, creating a wishy-washy overall impact.

Where I'm critical? There's a bit of a haphazard pace to this film. Many scenes contain plot points and/or action sequences that are unbalanced in terms of what is glossed over and what is overly drawn out. There were serious opportunities to do some world building with the new ingredients provided by the vigorously refreshing Asian cultural influence, but it felt like director Destin Daniel Cretton was often going through the motions, checking boxes like he was playing Marvel bingo. The climax, while visually appealing, was predictable from moment to moment and really did not have me on the edge of my seat. Tony Chiu-Wai Leung's villain also didn't quite stick the landing with me, though I've read that his character has really resonated with Asian audience members so I'll humbly accept that maybe his motives lay just a bit outside of my perspective. There were also several ""oh, okay, sure"" moments, lets call them, but a least the writers had the modesty to poke fun at themselves (see: Katy's awe at her own random overnight mastery of a certain skill later in the film).

What I really enjoyed? The cast and characters, first of all. Marvel almost always gets this right. Awkwafina's charisma is palpable. Her character, Katy, never gets in the way of Shang-Chi's natural progression and is genuinely interesting in her own right. I also appreciate the writers' restraint in not simply using her as something to be exploited by the villains to distract/misdirect Shang-Chi. Meng'er Zhang is also a revelation as Xialing, Shang-Chi's scorned, steely sister. Although, a bit more clarity on what her characters' ultimate goals are would have gone a long way as her post-credits appearance left me a bit confused as to where she stands in the greater story. In regards to Simu Liu, I personally felt like he got a bit hoodwinked by the writers who really didn't give Shang-Chi a strong personality other than kicking butt. Regardless, I totally praise his performance and find him endearing to no end. I have faith that he'll really shine when he's plopped into the dynamic of the Avengers. As an aside, just wanted to give an obligatory shoutout to the visual effects and concept designs of the mythical creatures and surreal locations in the film. They really nailed it.

To that end, a completely worthy addition to the MCU that sometimes feels like it's only purpose was to introduce us to the new toy in the Marvel universe that is ""the ten rings"" themselves.",3-Sep-21
illmor-814-204784,9,That sensation after a good enjoyable movie!,"So happy to see movies like this in theaters again. The ones that give you that satisfying feeling at the end. Honestly don't know if is tight to chinese culture but look quite respectful to it imho. Also didn't know about the character before and the novelty didn't disappoint as instantly become one of the best heroes origin film both DC and Marvel of course. Most of the cast is unfamiliar to me but nothing that demerits the product, on the contraire quite surprised by the good performances. The figths are very well choreographed to the point to bring back the sensations of Crouching Tiger Hidden Dragon. The effects are so well made that is very hard to find a defect to complain about. Mostly flawless to me. Remarkable the smoothness of the water scenes. Nature and creatures scenes are very well done too. Beautiful scenes appears with some regularity. Sound is terrific too. Is a Marvel movie and conserve the tone of all the previous ones. Enjoyable, interesting, not dark, well paced and of course well done. I give a 9 to counterpart the ones giving 6 star or less, but definitely is a solid 8 to me. Hope more movies like this appears more often as make super enjoyable the visit to the theatre (3D Imax worth it!)",3-Sep-21
liamdonaldson-15248,1,Absolutely shocking,"Awful film I wish I could get my money back, waste of time just awful.",23-Sep-21
imanib-36810,3,Fala Chen's Character Saves This Dud,null,4-Sep-21
bunnysth,10,Wttf,How are people giving reviews about it..it hasn't even released im confused.,1-Sep-21
ammaples17,10,Chicken pig,"Best marvel movie yet! Chicken pig. Loved this movie and I hope to see another one, very different from the rest.",3-Sep-21
adamstommy,10,Awesome!!,"Hands down one of my favorite additions to the MCU. The story is fun, unique, and refreshing. The cast is great - everyone has amazing chemistry. And the story is action packed and heartfelt.",3-Sep-21
matilda-79276,10,Breathtaking,This movie was so beautifully made that I cried from just pure excitement. I had forgotten what it was like to watch an action movie so well written and executed that it didn't need comedy every other second to distract you from the plot.,1-Sep-21
electronictealfuzzy,10,Beat Kung-Fu Marvel Film of the Year!,"Shang-Chi is one of the best Marvel movies in 2021 which can mean it really fits for a superhero like him. It reminds me of Mulan, and the Avengers movie at the same time. I can't wait for the sequel soon, too!",3-Sep-21
marcusman48,3,Effectively nothing new,"SHANG-CHI AND THE LEGEND OF THE TEN RINGS is being called ""the Asian BLACK PANTHER,"" and I think this is an inaccurate description for two reasons. First, Asian cultures have been explored in-depth by Hollywood since the 1970s at the latest, and in ways that sub-Saharan African cultures have not. But second, and more to the point, SHANG-CHI is really just a mashup of two Hollywood subgenres that have been around for quite some time: the ""ethnic discovery"" film and the ""stupid American tourist"" film.

The ""ethnic discovery"" film is the more recent type and by far the more interesting, ultimately inspired by Alex Haley's famous TV miniseries ""Roots."" It documents the saga of a protagonist who learns - or relearns - about his or her heritage and embarks on a quest to fully embrace that heritage. A good example I can think of is THUNDERHEART, in which an FBI agent (Val Kilmer) comes to appreciate his father's Native American ancestry while on a case on a Lakota reservation; a more famous but fantasy-based example is STAR WARS, in which Luke Skywalker learns that he has Jedi blood. On the surface, SHANG-CHI definitely follows this pattern.

Unfortunately, the movie's ""ethnic discovery"" theme is undercut by the clichés of an even older Hollywood storyline: what one film historian has dubbed the ""racial adventure film,"" but which I simply call the ""stupid American tourist film."" Common since the 1930s, this film plot follows Western (and almost always white) characters as they visit an ""exotic"" foreign land - often for purely exploitative purposes - and proceed to reveal their ignorance about the ""native"" culture. It has always been demeaning to both the ""colonizing"" and indigenous peoples, since the former are forced to make buffoons of themselves and the latter must bear the humiliation of not being taken seriously.

SHANG-CHI is an ""ethnic rediscovery"" film in that two Chinese-Americans from San Francisco learn (and, in one case, relearn) about the culture of their ancestors; but it is also a racial adventure film in that they are essentially Westerners who travel to China and find themselves in the midst of a culture clash. While not white - and, in the case of the titular character, an immigrant - Shang-Chi and his girlfriend otherwise fit the role of the ""stupid American tourist"" with their unmistakably American accents, annoying use of slang, pointless pop-culture references, and wisecracking sarcasm. The twist here is that, like Kilmer in THUNDERHEART, they revert to their ""noble savage"" origins once they have traveled to an ""ethnic"" place and ""gone native.""

Not incidentally, there's one more way in which SHANG-CHI AND THE LEGEND OF THE TEN RINGS differs dramatically from BLACK PANTHER. While both are based on ""non-Western"" comic book sagas created by white men, BLACK PANTHER turns stereotypes about black Africans completely inside-out, giving us fantastic science fiction instead of hackneyed ""jungle"" adventure. But SHANG-CHI is just the usual ""kung pow"" hash about the Orient, presented ironically but also in a way that isn't terribly original.

In fact, if there's another Marvel movie this one closely resembles, it's not BLACK PANTHER but DEADPOOL. Both combine wacky humor and serious (and even ""dark"") subject matter in a way that's very jarring and ultimately exasperating. But at least DEADPOOL felt fresh.",23-Sep-21
philip-ternstrom,5,Mediocre,null,12-Sep-21
ethanbresnett,8,A wonderful addition to the MCU!,"Shang-Chi is one of those Marvel films that feels like the full package. It has lots of brilliant trademark MCU humour and tongue in cheek quips. It has exceptional action which I'll get into a bit more. It also has solid connections to the rest of the MCU, balanced well between being its own stand alone film but laying hints of how this is going to fit into the wider story of Phase 4.

I'll start with the action as this is what Shang-Chi is famed for. Quite simply it's awesome. It has the best hand to hand combat the MCU has seen, and sequences that are steeped in Chinese culture, with the rhythmic style of Crouching Tiger Hidden Dragon woven into the fabric of this film.

The cast was brilliant. Simu Liu was a fantastic lead, and I'd be happy to see him grow into a big player in the MCU. Awkwafina as expected was fantastic, adding so much effortless humour to the film.

What I really love about Shang-Chi is that it has a very well explored and interesting antagonist. This can't always be said for Marvel films as there have been a few phoned in villains, but Shang-Chi doesn't come close to falling into this trap. Tony Leung really sold his role and gave it a lot of power and emotion.

In terms of plot they did a fantastic job of introducing us to this pretty obscure character. There is a lot of exposition and plenty of flashbacks, perhaps too many but I appreciate they had a lot of background content to feed us so I can't grumble too much. I loved how the plot was so mystical and magical, very much feeling like an epic adventure.

Yet again Marvel Studios knocking it out of the park!",4-Sep-21
tonymyles,6,"Fun, but not engaging","You may (or may not) find Shang-Chi to be a fun movie to see in theaters. The film is full of tropes, from the narration over an origin story, to an inner city urban flip on an distinctly Asian character, to the CGI we're to assume is real (that never quite does translate as real). This well-intentioned film about discovering who you are doesn't seem to know for sure what it is. For example, there is tie-in to the larger Marvel universe, but almost out of corporate necessity to set up subsequent movies versus narrative need to set up a deeper story inside itself. There's also more profanity than other films, often used as a momentary gag that doesn't advance the plot. Even the final sequences land in dark places that confuse the family storyline versus clarify it. If you're looking for a fun night out, perhaps you and your crew might enjoy this film... or you might crave something more significant.",3-Sep-21
hareshvaru,10,Good to see marval again in the theater 🎥 👍,Awesome movie. Good to see it marvel movie in theater.,3-Sep-21
ataliaoliver,10,10-Oct,Hands down one of the best solo marvel movies made.,3-Sep-21
bdf_32,4,Bland paint by numbers,Typical bland crap from Marvel. Generic and paint by numbers. This movie does nothing to be special. It was boring and honestly exactly what you should expect from Marvel at this point.,23-Sep-21
LumosX,4,"After the painful, painful opening: passable but overrated visual spectacle and a waste of talented cast members",null,23-Sep-21
TakeUpReel,6,What happens when you mix...,null,22-Sep-21
Gpanther67,5,A Middle-of-the-road film that should have been better,"Marvel's newest solo film that introduces an iconic hero from thier vast collection of heroes is certainly for the newer fans that didn't grow up with ""The Master of Kung-Fu"". Even Stan Lee (who was in charge of the company but didn't create Shang-Chi) has admitted he was a comic rip-off of Bruce Lee in looks and style. Adding a mystical and possible alien influence was in my view a mistake and not true to the character's story. Nor the reimaging of The Mandarin, which I found to be disappointing. Aside from the tired storylines which have become common in these Marvel films, the ending was a little over the top. Aside from these criticisms, I'll give kudos to a good cast and wonderful cinematography. If I ever get a faithful adaption of a Marvel comic I grew up with, I might be shocked. I am coming to the conclusion that these films are only for those under 30, since I don't recognize the heroes or villains. Not the worse film in the Marvel universe but not the best.",9-Sep-21
solomediag,6,Upsetting because it was so close to being good,"Some good action scenes, but almost all of them are interrupted by out of place gags like the IG Live guy and Awkwafina for the rest of the movie. Really hard to stay invested because of that. It gets serious for a long stretch in the third act (where it crams all the character development), but the goofiness of the multiple buttons robs what could have been a decent ending of any impact. The characters are left totally unaffected by the events of the film making you question whether they are sociopaths.",6-Sep-21
itsjawad-14241,10,Shang Chi: And The Legend Of The Ten Rings,"I thing, and very sure that Shang-chi: and the legend of the ten ring is going to a part of superhero movies ... And Marvel Did Well with the movie by not realasing it on Disney plus like Black Widow.",4-Sep-21
pearlcruzpickle,10,One of the top 3!,"Definitely one of the top 3 MCU films thus far. Right up there with Avenegers. And easily the best movie to come out of 2021. It has a quality to it that is hard to explain unless you see it for yourself and even if you are not necessarily a Marvel fan or if you are feeling that ""Superhero movie fatigue"", this has a more universal appeal that transcends that realm.",4-Sep-21
qgxbvc,10,Tony Leung the best!,"10 for Tony Leung, he leads the whole storyline, best actor in Hong Kong.",2-Sep-21
lilly-01372,10,A MUST see!,"This movie is a must see. I walked into the theatre really not expecting much, somewhat expecting it to be a corny movie filled with Asian stereotypes. God was I wrong! This movie beautifully captured cultural nuances that touched a deep part of me as a Chinese-Canadian. The movie also featured seasoned actors in Chinese martial arts movies including Michelle Yeoh and Tony Leung - brings back childhood memories. The cinematography was wonderful as always, but the plot was surprisingly touching. Also can we talk about how FIRE the soundtrack is! 10/10.",22-Sep-21
kierhamilton,10,Brilliant,"The fighting and visual effects are great.

I also loved the elements of Chinese mythology.",22-Sep-21
adelinogaspar,9,A love letter to the old martial art movies,"Everyone who grew up watching jack chan, jet li, samo hung, Donnie yen, and many others martial artists, must watch this movie.",21-Sep-21
umar-65633,8,I simply Love it.,"After long long time, something new and some refreshing. I am huge fan of Marvel world.",21-Sep-21
sinhaabhinav-00498,6,Over expectation ruined this movie for me,"Visually beautiful,good action sequences, great starcast but what ruined my experience was the over expectations, I went for this one after reading it's extremely positive reviews all around just like The suicide squad (even that was one was an average flick nothing else) but later turned out to be an average movie.. neither bad nor too good...",20-Sep-21
chaisesmith,7,Fine,"Terrific cast, fun character, and an enjoyable - if forgettable - story. This movie could/should have been solidly mid-tier MCU fare, but doesn't quite make it out of that Thor 2, IM 3 territory of MehCU.

There are so many cool/positive things in this movie, that were just completely washed out by terrible pacing, weird story points (32 year old Simu, playing the world's oldest looking 26 year old), and criminally boring visuals. Seriously, who decides to make a super hero kung fu action flick, in which every fight is in shadow or being panned over/cut away from?

Overall, there is enough fun just watching Simu and Awkwafina to make the movie fine if you're an MCU completionist, otherwise it's a safe skip.

Bright Side: Simu as Shang-Chi seems like he's going to be a real fun character to add into the MCU, even if his debut is less than stellar.

Alt Title: Shang-Chi and the Legend of the Ten Thousand Flashbacks.",19-Sep-21
seanyboy-30010,4,Meh,"The pacing was awful. The movie was so slow. It needed more fight, fight is good. The fight seemed like it was on 2 times speed. It was just meh. Would not recommend. Meh.",19-Sep-21
sprays-32359,7,This is incredible!,null,14-Sep-21
christopherstamp,8,Mostly good - Some bad,null,13-Sep-21
dragonsedge-77508,6,Stretched out way too far.,"Action would last A few minutes and then back to talking for 20.

Got old pretty fast and didn't need every back story shown for everyone after it was told by A character either.",13-Sep-21
asebaee-81953,4,Weak story great CGI,If you want CGI and epic fight scenes this movie is for you but if want anything else you will be disappointed.,11-Sep-21
georgedan-35163,5,"Shorter than a Bollywood movie, but drags even more",Just ask yourself where this movie would be without special effects.,6-Sep-21
S_Sinan,6,Too mythical for an MCU Movie,"I rated it 6, just for the great acting of the father and main character, otherwise, the movie's story is so predictable, already consumed in the anime and previous asian-myth movies.

Wasn't for the show up of Wong (and one other minor clue) no one could relate this movie to MCU.

Don't get me wrong, it's a good movie, but not MCU-good. Unless....the story is still to be connected, making this movie only a bridge to a greater story.",5-Sep-21
LiamAckerman,10,high expectations for phase 4,"Wow. I came into this film with mediocre expectations and I was absolutely blown away. One of the top 5 films of the MCU. Great themes, well-written leads, good chemistry between characters, top notch VFX effects, and the fight scenes were stunning! They were giving Winter Soldier hand-to-hand combat + modern Martial Arts w/ a twist. Everyone needs to watch this film!",4-Sep-21
rubysthapa,10,amazing!!,"I loved this movie. Amazing asian representation!

Very funny and intense. Brilliant fight scenes!!",4-Sep-21
garretj-77565,2,Really bad power scaling,null,5-Sep-21
benjaminskylerhill,7,Looking forward to the Sonic crossover,"They certainly picked the right director for this film; he seemed to understand that this script has a plot with too many generic elements and characters that are just serviceable. So, he really put forth the effort to craft stunningly choreographed, smoothly filmed action sequences that kept me more than engaged.

Additionally, this movie has some refreshing bursts of imagination throughout, including introducing us to the Marvel land of pokémon.

It's certainly better than Black Widow.",3-Sep-21
UniqueParticle,10,"""Stay in the pocket"" I loved this more than expected to","Daniel Destin Cretton created a tranquil really well filmed marvel story driven fun time! Simu Liu and a surprise character were the best along Awkwafina which is always delightful. I really appreciate the direction of everything especially the effects, action, cinematography, and the silliness is good! Might be odd or understandable this is one of the best marvel films.",3-Sep-21
levipali,1,0/10,"Makes no sense, áll the scenes took so long, if you don't count these useless long shots, the movie would take 30 minutes. Horrible.",10-Sep-21
jaredtalbeaux,10,Amazing,Wow one of the best marvel movies i have seen so far!,2-Sep-21
graysongamertag,10,Amazing Superhero movie,"The best super hero movie of all time. This movie is simply incredible in all parts, music, scenery, direction, plot, even the dialogues are incredible. And being an Asian American I felt represented by the film, basically incredible.",2-Sep-21
arrowappledesign,5,Was this Mulan or a Marvel flick?,null,8-Sep-21
kevinsweetland,2,Tedious...,"Maybe there are just too many super hero movies now, but I found it boring. Some visual aspects were good and it had an ok story, but just didn't find it as good as hoped for a ""new"" marvel take. The main actor seems more appropriate for a b flick too. He's new so maybe he'll grow.",7-Sep-21
nguyenducson-63124,3,Disappointing,"For the first time, the fight with two people was so amazing, but the farther, the more boring. Too many characters and effects have made the movie a mess and not very real.",7-Sep-21
samcochran-032401,6,An Incredible Movie Ruined By One Character,Incredible special effects. Incredible action sequences that stand out in the MCU. Incredible back story to Shang-Chi. Everything is incredible until Katy starts talking. There was no need for her character. She wasn't funny. If this movie didn't have her it would've been one of the top 10 MCU movies ever made. Everything good about the movie barely makes up for how much her character sucks.,3-Sep-21
logan-lp85,1,Save Your MONEY,This movie was bad... it have to be bots behind trying boost this movies review ratings.,8-Sep-21
atomeckova,10,"marvel im gonna break ur kneecaps for calling this movie an ""experiment""",Talented brilliant incredible amazing show stopping spectacular.,2-Sep-21
sentient-74528,5,More of the same,"Kind of boring film. The premise is interesting, but kind of comedic all over and with little compromise with being convincing. I mean, Marvel films have this requirement for suspension of disbelief by default, but this film kind of explains very little and the character's interaction is shallow and not very meaningful. The end is predictable, everything looks artificial.

Perhaps we are all vaccinated against Marvel's all over the place magic to a point that everything looks familiar, boring and flat. Or perhaps the film is just not that great.

My big problem with this film is the bus sequence at the start. It eeps going downhill. I mean.. if you can make turns with the bus, why does it keep going down all the time? Turn left twice, it will go uphill instead of downhill and decelerate, then turn to any side and it should come to a standstill. Not very clever, guys.",25-Sep-21
viveksinghchaudhary,5,Good movie and a must watch for a Marvel fan,"Loved the movie all the way though, but i am more interested in spider man movie <3.",4-Sep-21
sidboyka,10,Best MCU origin movie,The best start for a new phase in MCU. Keep it coming....can't wait to see the next chapter !!!,2-Sep-21
ktmbqkwv,1,Total waste of time.,Total waste of time. Iron Man 2008 is so much better. Meh........,4-Sep-21
Amthermandes,6,"Decent, but most DEFINITELY overrated. The novelty is wearing thin for Marvel","If you rarely are disappointed with Marvel films, and you consider yourself a big fan of them, then you will most likely enjoy this film. It's certainly better than a few of the last installments (by a small margin), but this film is proof to all others that there really aren't any fresh ideas anymore, and the Marvel antics are getting rather boring.

You have good guy who is lackluster in personality, has some family issues, turns out he's a very important guy in the world, has some impressive abilities which he hones, discovers things about himself, has someone close to him betray him, has to make some big decisions, engages in climactic fight, the end.

These movies are so cookie-cutter, all Marvel is now, is predictable pomp and circumstance with flashy lights and SOME, not many, redeeming qualities. Let's start with those first:

Choreography. There are some slick-nasty moves in most of the fight scenes. Action scenes, and entertaining fights is certainly one thing Marvel rarely disappoints.

Humor. Another typical trait of a Marvel film, you get some good chuckles here and there. However without Awkwafina, this trait would be almost non-existent. And this is coming from someone who usually doesn't care for the smarky humor of the latest generations. But she is rather funny without being TOO annoying and sarcastic.

Special effects and cinematography. Solid work, obviously they didn't downsize their SFX department. But compared to the bar set by previous movies in the Marvel world, it's not all that impressive.

On to the unflattering traits:

Story. WOOF. Predictable through and through, don't expect much of anything here. They could easily have held a writing competition at any average middle school for the students to write a basic action movie script, and the storyline for this film would have probably been the entry from the kid who won 3rd place.

Characters. Aside from a a select few, the characters are as flat as a pancake in a hydraulic press.

The humor and the action. While I mentioned this earlier as a pro, over time, it all got old towards the end. The attempts at humor starting falling short of the goal, and the action became stale.

It's about time to wrap up this dynasty of Marvel movies and move onto something else before it starts to smell like discarded scraps of reused ideas, and accumulate maggots of banality.",23-Sep-21
nabkw-33419,10,This was an amazing movie,I really really loved the movie it was so cool I don't like marvel that much but this movie was bazzar gooooood job Marvel.,21-Sep-21
