User Name,Star,Review Title,Review Text,Review Posted Time
dominicwood-14504,9,Who knew a superhero film could be so beautiful?,"I'll start by saying that if you're looking for a great story, you'll be disappointed. Shang-Chi is a pretty standard hero's journey at its core, which is a shame because the story could have been inspired by House of Flying Daggers and other wuxia titles.

So why a rating so high? Because where the story falls, everything else excels.

Shang-Chi is visually spectacular and a real treat for the eyes with some visuals that are incredibly distinct for the MCU. In regards to aesthetics, Black Panther walked so Shang-Chi could run a marathon.

The fight scenes are all amazing. There's one weak fight, but it's meant to be weak, and they're all very long, which is great to see. One of the early ones went on for a solid 5 - 10 minutes, which was unexpected but far from disappointing.

The first actual fight scene is my favourite in the MCU, and I was worried none of the others would top it, but they were all delightful to watch, and I was so glad they did a parallel of it later on. Either way, the writers went hard on the fight scenes and that paid off.

In summary, the story is lacking, but I'm glad in a way because that allowed everything else to shine. And shine, it did. I hope future directors take lessons from the aesthetics and choreography of Shang-Chi.",4-Sep-21
laviniadallam,10,something unique and fresh,"After 10 years of almost every movie being.armed combat, this one is fresh and the perfect start for phase 4 (yes, the start is with black widow but is something ""old"", too related to the previous phases), i loved every single moment, i got chills, i laughed. The soundtrack is astonishing, as the.cinematography. The best of the mcu if i may. Loved the colors. The fighting sequence leave you attached to the screen as they seem like they are dancing. All combined is something else, completely new and i can't wait to see more of simu liu as shang-chi because he was.brilliant.

Go see the movie!!",2-Sep-21
Radio-1s_Mr-MovieMad-Ami_104-1FM,9,"Crouching Tiger, Hidden MARVEL . . . And So MUCH , MUCH , MUCH , MORE 💎","A -BIG- Screen Mini Review. Viewed Sept.05, 2021.

______________________________________________________

Katy : ""That's fine...... you can just explain on the plane"". { Said to Shaun a.k.a Shang-Chi, marking a ""sudden and unexpected"" twist of events }.

______________________________________________________

1. "" So -{ MANY }- Upsides : ""Crouching Tiger, Hidden MARVEL"" { Gosh . . . . where do I even start❓} "" : Ang Lee's circa 2000 quasi-mystical Martial arts spectacular is the -Very- first film that came to my mind whilst watching a certain beautifully -{ "" Atmospheric "" }- segment of the opening-act of 'Shang-Chi And The Legend Of The Ten Rings' ( 'Shang-Chi' for short ) . . . . you'll know it -Immediately- upon seeing it . . . . featuring ""ever-fabulous"" Malaysian Mega Star Michelle Yeoh ; who of course was one of the -Principal- characters in 'Crouching Tiger, Hidden Dragon', -As well- . { FYI : this is by no means intended to be a spoiler ; -several- of the movie -official- teasers & trailers 'gallantly' feature the said scene, albeit briefly }. And what's more ...( trailers also )... if you're someone with 'even the slightest bit' of true passion for all things within the realm of sheer cinematic -{ FANTASY 🌠 }- , then you'll be absolutely -delighted- to know that Shang Chi -Also- has a distinct 'Harry Potter' aspect to it . . . & if even -that's- not enough for you . . . Then, get this, its got a 'full-blown dollop of Narnia' thrown in there for good measure, at that. To be -Really- honest, it felt a bit disorienting , -At First- , seeing all ""those types of elements"" in an 'MCU' ( 'Marvel Cinematic Universe' ) picture, but then I suddenly realized that 'Infinity War' -And- 'Endgame' both -Very- prominently feature, well ...{ a walking, -""Talking""- demolition derby of a, err, -""Raccoon""- }... in them, & I began to feel at home again, pretty darn quick.

2. "" There -Is- One 'Stark' Downside, Alas . . . . The MCU has had -{ WAY }- Too Much ""Muddled & Obfuscatory"" Messaging Vis-a-vis 'The Ten Rings', Over The Years "" : In 2008's -superbly- received { and completely -iconic- } 'Ironman', which is where we were all introduced to the bespoke militant organization, ( 'TTR' for short ), for the -Very- first time . . . . there is an ""Explicit And Unequivocal"" reference to the film's ( initial ) setting as being sometime within the USA's long 'War In Afghanistan', ( where the -Official- state religion is Islam ). Hence, by -{ EXTENSION 💡 }- , there is the correspondingly ""Glaring"", ( although tad more ""Implicit"" ), suggestion that TTR is . . . . . { from the immediately apparent ethnic backgrounds of the mostly Urdu & Arabic speaking members portrayed, to the group's visually -Distinctive- flag, right down to the undeniably frightening 'Imminent-Beheading' type video featuring a thoroughly bruised & bloodied Tony Stark as its centerpiece ( all too reminiscent of the -Horribly- tragic & bloodcurdling news stories that we've been, sadly, accustomed to reading about, hearing about and watching over the years ) } . . . . . 'yet another' archetypal, classic ""Islamist-fundamentalist"" type group. When in fact, as is -Strongly- conveyed to us in -This- particular picture, ( beginning all the way with the trailers itself ), that this is simply -{ Not }- the case. The said militant group does, of course, turn out to be, ( at its very 'Core' ), & by way of, this, its Origins-Story ; ""Not Arab Or Middle Eastern -At All-"" , but in fact . . . . -{ "" 100% CHINESE "" }- . Certainly very confusing, -especially- for the majority of us, who -haven't- read any 'Mandarin vs. Shang-Chi' comics . . . . Go Figure 🤷‍♂️ 🤔 .

"" Final Analysis "" : -{ If }- you can get yourself to basically -Overlook- the aforementioned, & ""Legitimate Inconsistencies"" pertaining to Marvel's cinematic representation of its Ten Rings Organization, then . . . . -Yes- , for the most part at least, you -{ Should }- believe all the ""Rave Reviews"" that this 'Utter Delight Of A Movie' has -already- garnered, 'Globally'. A -Huge- Shoutout to its 'rookie' ( -relatively speaking- ) Director 'Destin Daniel Cretton', who""s been able to achieve this feat with, get this, just his -""5th""- Directorial-venture . . . Ever 👏 . What started as a humble yet impassioned little comic book effort about 10 very magical, & { Phenomenally Empowered Alien ""MAKLUAN"" Rings } . . . By the ""Truly-Legendary"" Stan Lee & Don Heck in Feb. 1964 ( ""Tales Of Suspense, No.50"" ) . . . Has now become the supremely enthralling ""Fresh New Face"" of Marvel's 'BOLD NEW ERA' { that started with 'Phase Four' }. The film's 'Star' is newcomer Simu Liu, whose portrayal of the outwardly nerdy-seeming yet immensely likeable 'Shaun' works wonderfully { not to mention all his ( "" Super 😉 "" )-impressive Kung Fu skills, of course }, with his ever-jocular best companion 'Katy', ( Awkwafina ), showing an absolute -ton- of heart, courage, & most of all, -{ "" Fierce "" }- Loyalty, throughout. Tony Leung, Meng'er Zhang, Fala Chen, Michelle Yeoh, & of course Shang-Chi's Big, Fun, ""Open-Surprise"" .....the 'one & only' Ben Kingsley.... perform their respective roles with -{ "" Panache "" }- . So, all told, it's going to be "" A Completely Charmed, Fiery 9.50 Marks Out 10 From Me . . . . ROCK ON, MARVEL 👊 🔥❗"" .",8-Sep-21
mhatreritesh,9,It's a Visual treat,Perfect Fantasy film to watch with full family.. you can't miss this on big screen.,4-Sep-21
nishantsalhotrans,10,Best non-avengers MCU movie,"Keeping it short. This movie had it all. Great story, writing, direction, acting, villain, comedy and fight direction.

I'm a huge old school kung-fu movie fan and I was a bit sceptical about how they will show the fight scenes. Glad they kept it authentic with the fight director (who worked with Jackie Chan a lot). It was insane.

The story itself was superb. The villain's character development was amazing. The direction was not rushed and at the same time it didn't bore me for a single second.

Best non-avengers MCU movie for me. I can watch this again today after watching it last night.",6-Sep-21
truthtellers-16825,8,Fun Film That Does What It Is Supposed To,"Brought to you by the Truth Tellers.

Film is great overall and in this genre at least, is one of the best all year round that has been generally lacklustre. Definitely a good movie to watch as it does what it is supposed to in that it is generally a setup film for something bigger in the MCU.

Like many of the other Marvel Films in the MCU, they have to start somewhere. As an origin film it does it very well and perhaps the best origin / starting film for superhero movies that is full of action, decent story that is somewhat predictable (as it is for most origin stories) though generally fresh, fun and great characters. Definitely one to watch.

Final Verdict - Does what it is meant to do and provides the entertainment while doing it.",1-Sep-21
csheff3,9,"Honestly it's great, beautiful martial arts galore","Haven't been much of a Marvel guy even with their biggest event films, but Shang Chi is solid. Story moves quick, lots of great characters, almost nonstop action scenes, and a finale that they hid from the trailers. I was definitely way more into it than I thought I'd be. Props to the team on this one!",4-Sep-21
IliescuVictor,9,Out of the Marvel patterns,"I had very few expectations from this one, given the fact that it was an origin story with a character I know zero facts about. But let me say this, it competes with the Avengers movies when comes to cinematography, visuals and action sequences.

By far the best Marvel movie in the recent years, that puts many titles from its portfolio to shame.

The visuals are a blast, a true eye candy experience. There are a lot of new elements that Marvel seemed to experience with and it worked out perfectly. The choreography is spot on, as the fighting sequences are among the best I've seen, and combined with a good score, it turns out to be a very enjoyable seeing on the big screen. I think it's mandatory to watch Shang-Chi on the biggest screen you can get to.",2-Sep-21
handaloo,7,"It's not as bad as people are saying, it's also not quite as good.",null,4-Sep-21
JATIN-1989,4,What's up with these extreme positive reviews?,"I watched this movie after Twitter was claiming it to be the best movie ever, so I went with high expectations, after watching what I found is movie was mediocre at best, the CGI was great but apart from it everything is just ok at the best, I didn't connect with any character at all. To be honest wait for the film to come on streaming services, not worth it to go to the cinema.",4-Sep-21
MrSAsheC,5,Honest: A decent movie but don't expect anything you haven't already seen from Marvel.,"It's a decent movie. Happy that the comedic timing in certain scenes isn't overdone and it plays out to be a little more serious. The Mandarin in the movie by far the best acted out character and the choreography of the martial arts is on point. The movie is probably about 15 mins too long just when you think ""oh it's finishing up"" there's more. There is a notable difference in the second act with the story going more rapid and pacing is definitely the movies biggest flaw. Acting wise it's cool, nothing amazing or something you haven't seen before.

If you're familiar with marvel it's the exact same model as some of the other movies with it being about family (Thor, Black Widow).

Wanna have a good time with the family or just a decent watchable movie? This is one that you'll like.",2-Sep-21
delsoca,7,Strong 7/10,"I have just watched this movie. I am an avid Marvel fan. This film introduces a new character, there is that standard Disney approach, with a mix of comedy, seriousness and lots of action.

Disney work through the numbers on this film, there are no surprises and it does what it does on the tin.

The acting is good, special effects are solids and the story is not bad.

There's continuity linking to the other marvel universe which is nice for the fans.

I would actually pitch this at 7.5/10, not quite an 8 but higher than a 7

Those review of 1 or 2 out of ten are way off the mark, this film is not that bad.",4-Sep-21
wgeddings,9,A return to good Marvel movies,"If you are like me, from the previews and ads you thought this was a Kung Fu movie about a son rebelling against his crime lord father and the father sends men to force him to return and make him take over as the next leader of the criminal empire. Not an awful plot but not that original either. That is absolutely NOT what this movie is about. I love and hate that Marvel's trailer seldom give anything away and I am glad they are doing it again. That is not at all what this movie is about and I will not spoil anything.

The performances are good, the story is good and while not complicated, it keeps your interest. Funny parts, touching parts, action parts, it is overall just a good movie that was enjoyable to watch. It is not one of the best Marvel movies but it is a solid one and worth seeing in the theater.",5-Sep-21
MiroslavKyuranov,8,Absolute Banger!,"That was a freakin' blast! The story is complex and interesting it fills some gaps in the MCU and simultaneously is a great origin story for the character of Shang-Chi.

The whole cast is amazing, I mean there is so much chemistry between them. Simu Liu and Tony Leung are phenomenal in their respective roles. The Mandarin tho...so well created character.

The movie is amazing bridge between East and West culture. There is so much to explore, much like Wakanda. The history of Shang's culture is so rich.

The fight choreography is absolute kick in the gutts...in a good way. I mean this is something completely new for the MCU and they deliver it again! Everything looks so goddamn good and I can't help myself thinking about some scenes! Also, the colors, the effects, the camera work and etc. Everything is magnificent.

There is humor for sure, but there is also emotional impact. This is not some bland action packed movie, it's made with heart from fans for the fans. Kudos to the director Destin Cretton!

Killer soundtrack and the main song for the movie ""Run It"" fits so good with all.

There are a few surprises, that were hidden from the promos and trailers and man...just wait to see them.

About the credit scenes...they are two, both are good, but one of them is...SICK!

For sure deserves more than one viewing in the cinema, so much story building, details, action, fun. The people who underestimated this movie will be so surprised how great is it.",1-Sep-21
adamthorn-31294,10,Amazing,Shang-Chi was honestly amazing. The cinematic experience was great and the story and plot of the movie was very good too. I am a huge marvel fan and it makes me happy to see that they are branching out to different types of hero's from all types of backgrounds. To sum up my review I really enjoyed it and highly recommend. (stay for the credits to the end),5-Sep-21
Izzy2727,2,Stop Disneying our Marvel Dammit,"Couple of things, 1. The actors are made of plastic, I know it wasn't a CGI cartoon but the actors were so one dimensional it may as well have been. Have never seen live actors display the uncanny valley. 2. Feels alot more like a Disney film and less like a Marvel super hero movie. 3. It was super formulaic, Awkwafina was as usually not funny and every little chuckle was super forced. Overall had some good fight choreography but you can get that in any other Kung Fu Movie. Kind of makes you wonder why so much money was spent on a very very very template movie. Kind of lame.",4-Sep-21
maximfilipenko,5,Probably one of the worst MCU movies,null,2-Sep-21
valenkim,3,Great visuals but horrid storyline.,This is well done as far as special effects but the plot is so boring I couldn't take it and left in the middle of the film.,3-Sep-21
lakelazy,10,One of the Best Marvel Movies of This Year,"This movie portrays a villain that by far has been the best out of all the other Marvel antagonists. It shows his personal conflicts, his purpose, as well as his cruelty. The hero of this film are overshadowed by this, but the ending really makes a mark on the audience. Also the martial arts and action scenes are a treat to watch and the core of the film is about family.",1-Sep-21
jameszd44,9,Fantastic movie!,"This movie is much better than black widow, it's funny, it's exciting, and full of adventure!

Must see this summer!",4-Sep-21
casualmovienerd,1,Martin Scorsese Was So Right,"Martin Scorsese called most of these generic MCU movies theme park movies and This movie is perfect example of that. There are some great MCU movies, but seems like Marvel isn't even trying to separate themselves from theme park stigma, when they make movies like this.",3-Sep-21
dzzg,2,Not as Good as Some Reviews Say,Overall it's nothing new or very creative. I have no idea why some people pretend like it's new coming of movies. It's not. It's meh at best. Wait for streaming!,3-Sep-21
teomslaer,4,Great visuals but slow moving,"Well the fight scenes were exciting , the story was incredibly slow. Not the best Marvel movie but not as weak as movies like Thor: The Dark World. Some of the best visuals in any movie I have seen which helps improve the overall experience. Keep an eye out for a fun character to pop up as well!",3-Sep-21
ejarellano-66205,10,IT WAS FANTASTIC🔥🔥🔥,"The was really good better than I expected,it has a great story,best hand to hand fight scene and more! I can't wait to watch it again more than 10 times I absolutely love this🔥.",3-Sep-21
liveyj,10,Top tier MCU,"Solid performances, some of the best action sequences in the MCU, visually stunning and likeable characters. This film is not only an achievement for a marvel film but also a film on its own.",4-Sep-21
laceup-96849,5,Boring,"Another forgettable Marvel film, story is the same old but this time it's the asian version, I think the biggest issue is it's too long or else some of the action were good.",3-Sep-21
gavinp9,7,Enjoyable action film,null,1-Sep-21
rulaniyarakesh,10,Must watch movie of this year,Just an another amazing movie brought by MCU with adding a new character to marvel universe. Overall fantastic movie with the point of view of storyline and action sequences which really are one of the best among all marvel movies till now. It is clearly visible by this movie that there's something big planned by MCU in future which would be amazing to watch. At last just watch this movie you will love it.,3-Sep-21
gaberh1234,6,Visually stunning but overrated,"The fight scenes, creature designs and set are absolutely amazing, but overall story was sort of slow. Visually stunning but yet I couldn't help but feel it's a bit overrated. It also felt less connected to the mcu than most Marvel films and the first Wong/ Abomination cameo felt very out of place.",11-Sep-21
whatgoodmovies,3,Overrated,Extremely overrated movie for no reason at all. It doesn nothing new. Only thing marvel has left is Spider-Man right now. Everything else is just super meh.,3-Sep-21
galidayan,10,This is an awesome movie! Loved every second of it,"The best amount of tension and humor, with a great storyline and great characters. LOVED IT.",4-Sep-21
felixdenomme,9,A great Kung-Fu movie.,null,2-Sep-21
mandynguyen-89365,10,Amazing,Such a good movie. The asian representation is on point. If I could give this movie past a 10 star rating I would. Can't wait for what else marvel has in store.,7-Sep-21
mephisto2424,8,The perfect start for phase 4,"It is a story of self discovery, full of great character arcs, glorious fight scenes and The cinematography, choreography, plot - it could not have been done better. Simu Liu really shines as the main character: he brings so much charm to the role that it's easy to grow fond of him. CGI and the fight scenes were stunning!

The perfect start for phase 4 (I know, the start is with black widow but is something ""old"")Marvel hasn't made such a masterpiece since Black Panther.",4-Sep-21
kakuskari,10,Shang Chi is a Emotional Roller Coaster,"Shang Chi is an emotional roller coaster. Using the strength of its powerful and interesting villain, the movie successfully brings together the past 10 years of Marvel movies into a largely effective cocktail of super-heroic dramatics. Destin Daniel Cretton creates a superhero movie that it's every bit the epic that it needs to be. However prepared you feel, you are not ready for the villain, Mandarin . Shang Chi is stunning, hilarious and heartbreaking and one of the best action set pieces of this year which is the bus scene.",1-Sep-21
pewpewds-27356,10,Blew away my already high expectations,"I had very high expectations and Shang-Chi still blew me away. Definitely the best Marvel movie to date, the story was great. The villain wasn't boring and didn't have lame motives, the characters were well written, the music was fantastic and the fight scenes and special effects were amazing. It's also a very easy movie to understand and enjoy if you aren't very well versed in Marvel movies as it's Shang-Chi's introductory movie. Highly recommend.",6-Sep-21
valmont1702,9,"Poetry in motion, layered story, emotional adventure. A sparkling jewel.","Shang-Chi and the Legend of the Ten Rings is a wonderful movie in so numerous ways... Visually striking, with a great mastery of the staging from beginning to end.

So much visual poetry, the legend/adventure aspect of it is really top-notch, with legends & mystical elements that grab you ever more with the story unveiling before your eyes ... The humor is very pleasant (Katy, played by Awkwafina, brought a welcome energy & heart in each of her scenes) and adds a pretty pleasant flavor to the whole adventure.

I really loved the way the characters are written, with Xu Wenwu (Tony Leung) as a complex & layered figure all along the movie... And Xialing (Shang-Chi's sister, played by Meng'er Zhang), as well as Li (their mother) are both highly enjoyable to see express themselves on-screen, they both have a lot of presence (and skills), each in their own ways.

I found the entire movie very coherent, every detail makes sense and is counter balanced in a way or another... Yes, there is a strong notion of balance (darkness & light, and so on), with a lot of messages infused in both the action & dialogs. It is an extremely entertaining movie, but I really wanted to emphasize the richness and depth of its story/mythology and characters, all connected in the most organic way.

By the way, I loved the whole Asian/Chinesz myths & legends aspec of the movie, the spirit & philosophy of it all was a true delight to my eyes, with countless Sci-Fi elements entwined in it, but all smoothly integrant of this mythology... I think I probably put it in my Top 5 Marvel movies... I found the staging really majestic, from the dialog scenes to the action scenes, the humor, the flashbacks, and this new ""universe"" (mythology) that is presented here, it just all flows in such a delightful way from beginning to end.

Marvel Studios always are very very clever at hiring a great variety of talents, and they nailed it once again... Destin Daniel Cretton (the director of the movie) is super creative and manages to construct pretty complex scenes while always masterfully telling a story, building a deeply cohesive piece ; it's all fantasy but nonetheless feels visceral and real. This movie is another Marvel movie you often forget that it is a Marvel movie, precisely because of its powerful and so deeply captivating mythology, and this emotional weight that you can feel over the characters, it truly sets something different. It felt like I was watching a movie in the vein of certain epic Asian adventure/martial arts movies... Gotta admit it's my jam, so... In addition to the Marvel stuff, it's a very pleasant feeling.

The energy in the movie theater was fun, lots of people were excited from all these scenes that just grab you. Because yes, clearly... There is a good number of mind-blowing scenes in this incredible movie ! The photography and color treatment make the movie very striking... And like I said, certain scenes mesmerize you because of their beauty & mastery, or even their grand epicness ! At times, it feels like an epic fresco that you are contemplating.

The scene when/where the two parents meet for the first time is beyond gorgeous (the setting, the colors, the choreography, the costume design and overall design, the music & sound effects, the characters and the atmosphere as a whole) ; an absolute masterpiece of art, visually way beyond sublime, what a gift for the eyes, wow... And the 'Grand Final' is quite simply epic, emotionally grabbing, and of course stunning visually, with a flow of glorious shots that all are impressive.

A jewel.",1-Sep-21
Sleepin_Dragon,9,Wow!,"I was not expecting that, I had visions of a film along the same lines as Snake Eyes, that was an out of date bagel, this was a four course banquet.

Fast paced, energetic, and relentless, not particularly the genre I normally go to, or enjoy, but I loved every second of it, a visual masterpiece. Superb acting, terrific musics, but it's produced in such a magical way, it is stunning.

I plan on seeing this again, just to understand a few bits a little more.

Go and watch it, you'll love it, 9/10.",9-Sep-21
axterwho,8,hell yeah,"Amazing martial arts and epic fights, but it lacks plot in the ending and it's quite bland. Still it's one of the best hand to hand combat MCU-movies I've seen. Good usage of comedy as usual for the MCU.",4-Sep-21
