User Name,Star,Review Title,Review Text,Review Posted Time
witra_as,9,Seamlessly combined modern martial arts fantasy and Asian mythology into MCU fashion,"Seamlessly combined modern martial arts fantasy and Asian mythology without cringe/dull moments made it a different kind of MCU movies to entertain international audience.

Mind few (back and forth) narrative problems, Destin Daniel Cretton successfully put humor and heart in right time and places.

Thanks to scintillating cast who lit up the screen especially charismatic Tony Leung.

Chemistry between Simu & Awkwafina as besties are undeniably good.

Action scenes including CGI works definitely made some nice highlights.

Going to watch it over and over again, IMAX gave better experience for sure 😁",24-Sep-21
justinwfirestone,4,A cookie-cutter snoozefest,"Crouch, you tiger! Hide, you dragon! Wax on and wax off, and fight, fight, fight!

The title is as annoyingly long as the movie itself, which itself is an exercise in some ho-hum and perfunctory dotting of Is and crossing of Ts. As we wade into the shallow waters of whatever the next batch of uninspired Marvel movies present to our collective global faces, it becomes increasingly difficult to feel that old sense of joy and inspiration moviegoers used to call Movie Magic, maybe because everything is oh-so-magical all the time, a crisp and bloated 132 minutes worth.

It seems almost impossible to reveal any spoilers for a movie such as this, where the plot could fit on a business card printed in a large font, something like: ""Hero shows off, struggles midway, then overcomes substantial adversity to win once again."" Will there be any sequels? Will Shang-Chi become part of the greater Marvel Cashcowiverse? Will Disney buy up other intellectual properties and make more of the same type thing?

It should not feel like work when one goes to a show, and it is completely acceptable to check one's brain at the door, but these movies are becoming absolutely tedious, ponderous, even. Ponderous.",17-Sep-21
danicantorres,5,It's very entertaining,Visually it's one of the most interesting and amazing films from the MCU. But the script is really bad and poor.,17-Sep-21
billteller,9,So good,"I like, and watch quite a few, 'Asian' martial arts movies. This isn't one...sort of...but the martial arts in it is really good. Some shock to say Awkwafina has a great role and she plays it so well. Even if you only slightly like the MCU, you have to see this movie. And stay through ALL of he credits.",12-Sep-21
lokheiusa,10,So great to watch,It's better than expectations. TONY is a really good actor. It consists of many Asian elements which makes the movie more interesting.,11-Sep-21
ilanghitelman,8,Here we go Marvel,null,10-Sep-21
gdando,8,Definitely a solid 8+,"From the first 20 minutes you can tell this was going to be a great movie and well produced.

The fight scene in the bus, graphics and animation were unreal. And for the actor, felt like I was watching a new age Jackie Chan.

The movie had a lot of comedy, action And story line was a little played out but still amazing.

Best part is going to a movie that you hardly heard about and you're not really expecting much from the movie and it ends up being great ..

Not really a spoiler but stay past the credits haha.",10-Sep-21
rajparadhwanit,10,Best movie with The Top Notch VFX. LOVED THE MOVIE,Best CGI. And must watch Movie. With Top Notch VFX. Loved the Movie So Much.,5-Sep-21
ashimavi,9,Jackie Chan's way of filming fights,"During watching movie i had this flavor of Jackie, after the film i found out that Brad Allan from Jackie team helped with fight scene...want to rewatch it again.",5-Sep-21
kavishn,9,Great start for the new heros,"The film really went well from beginning to the end. It was really great with the visuals. The bus action sequence was great and visually was a treat to watch. Simu liu did great as shang-chi.

Climax is something which you should be most awaited for. Cheers for the whole the team of shang-chi.",5-Sep-21
clobusan,10,Loved it!,Loved it from the beginning til the end. This movie deserves all the hype and I was not disappointed.,5-Sep-21
nrone-04844,10,More than a marvel movie,"How do I start, this movie first is full of excitement, i just seen it and i was blown away, the visuals was stunning and the fight scenes?? Well i will say it was more than i expected in a very good way, i mean they were throwing down in this movie, it feel like a marvel movie not saying marvel is a bad franchise movie wise but...it has its own feel to it i do feel there is more to this movie, i will say i dont think the ten rings are the ten rings but something else, there are a lot of easter eggs in this movie from the hulk to iron man but they don't spend a lot of time going back in the past about heros, just small nods to some of the heros and certain movies, all in all this movie has strenth unlike black widow which had me falling asleep from time to time, a must go see, get the family and go see it in dolby digital at the theaters or imax, the beginning moves slow but it picks up and you're drawn in, I'm going back sunday to see it again, and i might go back the following sunday to see it as well, the movie is just that good...enjoy the watch of this movie, if you do not go...wel thats your lost.",5-Sep-21
namarie-31456,10,Epic!,"This was so epic on so many levels, far surpassed any expectations. The story was fantastic, visually stunning, and the fight sequences were phenomenal! My favorite Marvel movie in a LONG time. Outstanding, so excited for the rest of Phase 4.",5-Sep-21
devindevil,10,Amazing,"Story amazing, fight scenes amazing, scenery amazing, everything amazing.",5-Sep-21
terrylarosa,10,An amazing entertaining movie,null,5-Sep-21
thuyvihinh,10,Amazing movie - way better than expectation,"The movie was such a beautiful motion picture and had such amazing things to share in regards to culture. The lines outside the theatre were long and they were all different lines for different Shang Chi movie times. At first I was like wow is it really that good? But after finishing I found it to be super touching, heart wrenching at times, but still meaningful, and a marvel cinematic masterpiece. I encourage people to watch it! 1000/10 if possible!",5-Sep-21
zmrsfphj,10,Spectacular,Felt so fresh. This is exactly the type of movie the MCU needed to keep the hype train chugging.,5-Sep-21
coltongarner,10,Awesome,Best marvel movie since Thor Ragnarok. Great new addition to the MCU I love this movie and it just makes me seem so fresh and revived. The action scenes were so good the best since winter soldier and I just fell in love with this movie.,5-Sep-21
alandeza,10,Stunning,"This martial arts film was stunning. The action choreography was a visual treat, all of the cast was tremendous (Simu is a star and Tony is a legend), I loved as an Asian how it brought forth our culture without it feeling forced, and I loved the central story of family. This film deserves all of the praise it is receiving.",5-Sep-21
stevomachine-82062,10,ONE OF THE BEST MCU FILMS BY FAR,"ONE OF THE BEST MCU ORGINS STORIES EVER TOLD, this was SUCH A SLEEPER FILM.!",4-Sep-21
tetolover-17661,10,Great Movie,Depicts Asian American life perfectly. Can confirm as a SF asian American native. Katy's pretty damn accurate.,4-Sep-21
karwan_m,10,Worth the hype and REALLY FRESH in the MCU,"I was truly hyped for this movie just by seeing the bus clip and the trailer. I'm a huge marvel fan (not a comic reader), so I didn't know anything about Shang Chi, only heard about him. After seeing this movie, I was truly amazed. It was funny, the action sequences were very amazing, the fight choreography was awesome, reminded me of Jackie Chan. CGI was amazing.

I gotta say, after seeing the movie, Shang Chi is in my top 3 favorite Marvel Charachters, and the best MCU movie for me.

ITS WORTH WATCHING. Don't listen to the negative reviews. Go see it.",4-Sep-21
amycao-18086,10,So insanely good,"Plot, action, comedy, emotion, character, relationships, theme, development, cinematography, all 10/10. Go watch!!",4-Sep-21
wmshd,8,Worth the Watch,null,4-Sep-21
thebrandedswordsman-34028,6,How Is This New?,"This is just like any other Marvel movie; the only difference is the majority of the cast is Chinese. Which was the same situation with Black Panther, so it isn't new.

It's still an action movie, there's a lot of humor sprinkled throughout much of which comes from a ""quirky"" sidekick, it ends with a big CG battle, and there's more setup for the next thing during the end credits. It's tiresome now.

The action is good, the acting is good, the story is fine, the characters are fine, the music is fine; overall, it is an entertaining movie, but the Marvel formula can only work for so long. For me, anyway.",21-Sep-21
stefandejeger,2,Comedy or action movie?,"I wasn't sure if I was watching a childish comedy or action movie. I mean the first guardians of the galaxy had the perfect joke/serious mix in my opinion but this movie was constantly making me cringe and uncomfortable. The CGI was great but that is pretty much the only positive side of this movie in my opinion... In terms of story I was surprised there was no deeper background on where the rings actually came from, I'm not saying it needs to be in the movie but just something I missed.

I noticed a lot of people enjoyed this movie when I was in the theaters, so I am happy a lot of people actually enjoyed this movie. I guess marvel is not for me anymore.

This is MY opinion :)",19-Sep-21
cifers,3,"Marvel ruins the Mandarin again (and Shang-Chi, too)",null,7-Sep-21
bastianmanuel,8,Marvel is trembling the theaters again!!!,"Shang-Chi and the Legend of the Ten Rings is the 2nd mcu movie returning to the cinemas all over the world and WHAT A WAY TO GET BACK IN THE GAME. As many marvel/mcu films has the good and the bad.

The good: The most remarkable factor was the coreography from the action/fight sequences, very fluid and not exagerated.

The soundtrack was another amazing factor, we are talking of a mixture of cultures (i really felt Black Panther vibes on this one) that can engage all the marvel and non marvel fans out there.

Regards of the plot, this one was very emotional and with lot of heart and power.

The cgi effects was on point (which was my biggest fear and sometimes a let down on other mcu films)

The bad: Shang chi, along side of the cast lacks of good and reliable acting which with combining with the signature forced jokes was little annoying to see.

Althought the plot was simple, this was a little predictable, but overall enjoyable.

Final thoughts: Despite of the forced acting, A must watch movie that definitely will engage the audience with all its assets.",21-Sep-21
jituramnisad,9,must watch.,"Its one of of the best movie of this year. People missed its 3D version. Nice Graphics, simple storyline, fantastic Action.",21-Sep-21
hongswilliam,10,Diversity matters and this shows it,"Coming from an Asian American upbringing, I saw parts of my personal story play out on the big screen. There's something so affirming and beautiful about seeing parts of my story that I wanted people to understand now be on full display. Tony Leung specifically did a wonderful job depicting a complex father, something that we all can relate to in some shape or form. Marvel needs to invest in this franchise heavily.",21-Sep-21
qdliusiwen,7,Leung's acting overshadowed everything,null,20-Sep-21
TBJCSKCNRRQTreviews,8,Indeed legendary,"It's been ten years since Shang-Chi(Liu, charming, stoic) last saw his father, and leader of the criminal empire The Ten Rings, Wenwu(Leung, charismatic enough that we feel a lot of empathy for him, even when he does terrible things that we desperately want him to stop doing). That was also when he last spent time with his sister, Xialing(Zhang, a badass who deserves more screen time. Honestly, I'd be very surprised if she didn't, in future projects). He's joined by his friend Katy(Awkwafina, quirky, providing a lot of comic relief, something I'm told she's in general adept at), for what can best be described as a tense reunion, which allows the movie to really mine the family melodrama, one of the best elements it has. I won't give away exactly what the antagonist intends to do, only that our hero has to stop him. However, he has to figure out how, maybe even if, that is even possible.

Not quite, yet almost ""Black Panther for Asian audiences"", this does a lot for representation(including for women. Some of the best characters in this are female. In addition to the two that I've already mentioned, there is also Ying Nan(Yeoh, wise)), it is positively drenched in Chinese culture(the third act, while in ways it feels like it belongs to a completely different film than the first two, takes an especially deep dive into that. Ultimately, it is presented through a Western lens, and clearly we need to go further in this direction, still, it is a big deal that they put so much of it in an estimated $150 to 200 million major blockbuster, which will be seen by millions of people who would never consider watching an art picture, especially one focusing on a group they don't belong to), to the point where countless times, when it makes sense, major characters in this speak Mandarin to each other, rather than English, which it is subtitled into. And ""don't worry"", for those who think that the following is important: there are white people on screen, and they aren't made out to be ""less than"".

The action(each sequence of which feels distinct, belongs with the rest, and is memorable) pays tribute to many different kinds of martial arts films, acknowledging that they are standing on the shoulders of giants. Jackie Chan, wuxia, etc. The choreography is matched in skill by the cinematography. Not only are we seeing incredible fighting, the camera is dynamic, celebrating and highlighting how incredible it is. That *is* why you hire Bill Pope, the director of photography on the Matrix trilogy, two of Sam Raimi's Spider-Man entries, Darkman and Team America. The special effects are excellent. There are some issues with pacing, and certainly a chunk of this is composed almost entirely of flashbacks.

This features relatively brief but highly concentrated, surprisingly graphic gore(you know, there was a time when the fact that it's happening to beings that clearly are not human, wasn't enough to get away with this kind of thing with a PG-13 rating. Pepperidge Farm remembers), as well as a little strong language. I recommend this to any fan of comic book movie adaptations, and people passionate about diversity hiring. 8/10.",10-Sep-21
kartikshiradwadebgm,10,THE BEST SOLO SUPERHERO MOVIE OF 2021,"What an Amazing Movie...... REALLY A VISUAL TREAT FOR THE AUDIENCE.

Shang-chi deserves The Best Solo Hero Movie Of 2021.

Visual effects are the best Super powers of Shang chi are really good.

Dont miss the 2 Post credit scenes MARVEL FOREVER.",5-Sep-21
johnsoncameron-63928,10,"Marvel, youve done it again😍","This is the best marvel film i have seen besides Endgame, it bring a whole new feeling to the MCU and it pays off tenfold. Not much else to say.",5-Sep-21
brandonbarker-00825,10,Great,Didn't know about the movie and was skeptical but ill tell you u won't regret it. Best movie out of covid times.,5-Sep-21
almostfamus-93022,10,Best CGI STORY IN MCU TO DATE AND TO THOSE BAD REVIEWS HAVE NO TASTE AND DIDNT WATCH,The CGi and story telling was out of this world. Character development too! The ones who gave it a bad rating clearly has 0 taste and probably did not watch the movie. This movie made people into shang chi fans! Marvel stepped up! And I am happy!!!!,4-Sep-21
onsaltcoatsbeach,1,I was very embarrassed to watch this film as Asian,"I understand how diversity is important and it seems like one of such thoughts in this film.

But no, I felt so strange to watch this film the last night, somehow I was ashamed and embarrassed with the story and all about this film.

Respect the diversity, understand how Chinese market is important for Hollywood today, but please keep some balances and make more natural films.",11-Sep-21
xialing,10,Bringing up MCU to new world,"POSITIVE -great Casting (SImu Liu, Tony Lueng). Especially Tony Lueng because he look badass and has great acting skill.

-You've already heard people praising the film's action choreography, and it's well-deserved. It doesn't has many cut scenes like many MCU fighting scenes.

-This film felt completely unique from what we've seen from the MCU already.

-Props to the beautiful cinematography and soundtrack as well, they were great!

-The first two act was incredible and amazing showing the life of Shang-Chi, how Wenwu meet his wife etc. This type of act is something MCU usually doesn't have.

-This film open up MCU to new world with myth creature, many evil organization, and the mystery of the Ten Rings.

NEGATIVE -The casting was STELLAR. Aside from the one person I didn't care for (*Razor Fist, cough cough*) everybody played their roles to perfection.

-The jokes may not be funny to some people. But It's funny to me.

-The only issue I had with Shang-Chi was the third act. Not that it was bad, but it felt detracting from what the first 2/3rds of the movie established. It become every MCU logic part(CGI BATTLE). It took away from the great hand-to-hand action stunt work, but it's to be expected from a film of this genre.

character into this universe.

IMO Great way to introduce new hero. Great Martial art fight scenes. Great characters. Looking forward to Shang-Chi. Also Wenwu.

Not a Top Tier Film in Movie Industry but A Top Tier Film in MCU STANDALONE movies.",3-Sep-21
Rainbowbeany,8,I want to be Shang-Chi!,"Really awesome fights. Some of the best in the MCU! The fact that Shang has a poster in his room, from the movie The Warriors is amazing. I had a really fun time! It was funny and heartfelt. Crossed the line into cheesy a time or two.",2-Sep-21
aanimoh,10,Amazing,10/10 the fighting is absolutely magnificent like we are watching a Jackie chan movie.,1-Sep-21
hershpithwa1,8,Finally a Good Marvel movie,"Finally a Good Marvel movie. Was sick of nonsensical movies by Marvel and DC since long with dad jokes type of dialogues and no concrete storyline or material like Avatar. But I liked this one. Maybe Hollywood should make an Indian Avatar based movie, that would be exciting like some old Indian Gods mythology type of movie. As Bollywood really sux when it comes to making such movies, they're only good at making good biopics.",18-Sep-21
haw-98949,10,Loved it!!!,Everything about this movie was amazing!! If you haven't watched. Watch. Now. My only problem is that they didn't really use that many characters that were hyped up. Such as the death dealer and the abomination.,18-Sep-21
sme3,8,Solidly Entertaining,"The Marvel machine continues to turn out grand entertainments with remarkable regularity. SHANG-CHI is no exception. This film mixes light drama, comedy, and action in an entertaining brew. The visual effects and art direction impress. Though the action scenes are exciting, the presence of Michelle Yeoh occasionally reminds of films where thrilling stunts and martial arts were performed without the aid of visual effects.",18-Sep-21
hoernkeem,7,"Shang-Chi and the Legend of the Ten Rings (2021, Destin Daniel Cretton) MCU's new hero is vital yet his story feels derivative",null,18-Sep-21
moviematthewh-60783,8,"Standard repetitive storyline, but the concepts are creative and fresh","Right from the start I realised that the plot structure and storyline was very standard and repetitive. It's seen in many other action/superhero films. But as the action kicked in, I was still invested. It's a very fast paced movie with some new action sequences we haven't seen in the mcu yet, as well as some good comedic moments. The choreography for the action is one of the best I've seen in a long time. Very long cuts show all the action without quick cuts after every move someone takes. It's also a very beautiful film I thought in terms of scenery and colours. Music was also great, epic score and some killer songs. Definitely check out the soundtrack. But as the film entered its long third act, the ending was very underwhelming. We are being thrown at with so much stuff in a short period of time, so the reveals of some things and actions aren't as interesting as they should of been. But the film has opened up even more possibilities for what's to come in the mcu timeline, so make sure to stay for those credits scenes. But even someone who hasn't seen any or a few mcu films can watch this as it's a good standalone film. They may not understand a few things that characters talk about regarding previous events but I could assume that they'd still be invested. Overall, a solid entry for our new character Shang-Chi in the mcu, as well as having some awesome action, funny moments and eye popping miss en scene.",17-Sep-21
kluseba,7,Marvel movie by the numbers with beautiful dragons and charming locations,"Shang-Chi and the Legend of the Ten Rings is yet another movie inspired by the Marvel universe that has constantly been inspiring the cinematic world for more than a decade now. While the movie follows the usual stereotypes, it manages to stand out with its stunning special effects and locations.

The movie revolves around Shaun, a Chinese immigrant living in the United States of America who is working as a valet with his quirky friend and soulmate Katy. One day, they get attacked by a group of assassins on a bus and only just manage to survive. Shaun immediately understands that the attack must be related to his influential estranged father. Along with Katy, he decides to team up with his tough estranged sister Xialing to find out what's going on.

This film convinces on multiple levels. First of all, the acting performances are quite quirky and convincing. Especially the ladies steal the show. Awkwafina delivers the goods as curious, dynamic and funny woman that anyone would like to have as a friend. Zhang Meng'er on the other side represents a much darker character shaped by dramatic events from the past who is much more difficult to approach with her tough, relentless and independent personality.

The expensive special effects certainly deliver the goods as well. The scenes in a fantasy world, in Ancient China and in contemporary San Francisco are all equally stunning to watch. The fantastic creatures such as dragons look impressive on the big screen.

The story might be predictable but is nevertheless entertaining from start to finish thanks to steady pace and inspired execution. You will truly care about the fates of the different characters as you are watching this film.

However, this film isn't without its occasional flaws. First of all, lead actor Simu Liu simply doesn't have the charisma of the other actresses and actors involved. Casting him was a bold choice but it didn't fully pay off in my opinion.

Up next, the movie desperately tries to connect to other characters in the Marvel Universe. The appearance of Trevor Slattery played by Ben Kingsley is completely random as it only seems to be a pretext to offer some misplaced comic relief. The mid-credit scene starts in an amusing fashion but suddenly involving Bruce Banner and Carol Danvers only seems like a weak attempt to develop a hype for potential sequels. The same goes for yet another scene after the credits that evokes more questions rather than concluding the film appropriately.

At the end of the day, Shang-Chi and the Legend of the Ten Rings is an entertaining fantasy action film of the Marvel Universe that should appeal to faithful and occasional fans alike. It's one of the better films in the franchise but perhaps Marvel should focus on quality over quantity instead of becoming a monstrous capitalistic machine that is scarier than any gigantic dragon shown in the film.",17-Sep-21
kaden_lewis,10,Shang-Chi and the Legend of the Ten Rings,"This movie was great, it was entertaining, it was fast paced, and it was unique. There were so many things I liked about this film. First off, I loved all the characters, such as Shang-Chi, Katy, Xu Wenwu, Xialing, Razor Fist, Death Dealer, the return of Trevor Slattery, Morris, and of course Master Guang Bo. The actors for all these characters were also perfect. They suited their roles perfectly. In my opinion, this movie had some of the best supporting characters in the MCU. I also loved the action. It was absolutely amazing, there were some points in the movie where I felt like I was watching a martial arts movie. The stunts and the choreography were perfect, I couldn't have asked for anything more. The effects in this movie were also stunning. The moving forest, the mythical creatures (especially the dragon), and the effects used on the Ten Rings were super cool. The effects in this movie were some of the best in the MCU. Lastly, I also loved the plot, it just sat really well with me.

This movie was like nothing we have ever seen before in the MCU. It was very unique and a nice twist for Marvel. The first Credit Scene was also very interesting and might have set up phase 4 in the MCU. This was a great movie, and I definitely recommend going to see it, even if you aren't a Marvel fan.",16-Sep-21
ximenamonzonc,9,Best mainstream movie of 2021,"This movie was all around amazing. The visuals were amazing, it was a very heartfelt story and Simu Liu's and Tony Leung's performances were truly extraordinary.

I didn't give it 10 stars because the final battle felt a little underwhelming in comparison to the rest of the movie (something I have noticed is a common theme in Marvel movies).

Would honestly give it a 9.5.",16-Sep-21
